Título,Texto,Score,Comentarios,Fecha,URL
"Exclusive: US Justice Dept grant cuts valued at $811 million, people and records say",,236,6,1745532787.0,https://www.reuters.com/world/us/us-justice-dept-grant-cuts-valued-811-million-people-familiar-say-2025-04-24/
A wrong turn onto a bridge at the US-Canada border has a Detroit woman facing deportation,,838,88,1745532602.0,https://apnews.com/article/detroit-immigrant-detention-bridge-canada-border-820a956eba7d09d6f956d6a148b9bf6b
Blue Shield of California exposes 4.7M individuals’ data to Google Ads,,1457,41,1745528137.0,https://www.scworld.com/brief/blue-shield-of-california-exposes-4-7m-individuals-data-to-google-ads
Rwandan genocide leader living in exclusive New York enclave arrested for alleged immigration violations,,4129,131,1745525838.0,https://abcnews.go.com/US/rwandan-genocide-leader-living-exclusive-new-york-enclave/story?id=121129509
Feds accidentally publish secret plan to kill NYC congestion pricing,,27626,1282,1745514474.0,https://gothamist.com/news/feds-accidentally-publish-secret-plan-to-kill-nyc-congestion-pricing
Man charged with arson after authorities say he sparked New Jersey Pine Barrens fire,,465,37,1745514376.0,https://apnews.com/article/new-jersey-wildfire-smoke-ny-air-quality-67b146ae19bef2cb111d7efc3d0b563d
"After a scathing rebuke, judge grants DOJ an extension in deportation case",,1741,150,1745513326.0,https://www.npr.org/2025/04/23/nx-s1-5373746/federal-judge-blasts-trump-stonewalling-deportation-case
Maryland judge orders return of Venezuelan asylum seeker deported to El Salvador | CNN Politics,,1652,81,1745505693.0,https://www.cnn.com/2025/04/24/politics/maryland-judge-return-venezuelan-asylum-seeker/index.html
German beer sales down at home and abroad,,397,146,1745501688.0,https://www.dw.com/en/german-beer-sales-down-at-home-and-abroad/a-72306658
Texas creates its own DOGE in attempt to make the state more business-friendly,,6544,782,1745500699.0,https://www.keranews.org/texas-news/2025-04-24/texas-creates-its-own-doge-in-attempt-to-make-the-state-more-business-friendly
Benin admits that 54 soldiers killed in border attack by Jnim,,1779,140,1745495095.0,https://www.bbc.com/news/articles/c4grjgkxn9vo
2 men detained at Albemarle courthouse in alleged ICE raid,,1028,70,1745489956.0,https://www.vpm.org/news/2025-04-23/albemarle-courthouse-ice-raid-nicholas-reppucci-teodoro-dominguez-rodriguez
Judge rules federal government owes nearly $28 million to North Dakota for pipeline protests,,3378,43,1745483267.0,https://www.nbcnews.com/news/us-news/judge-rules-federal-government-owes-nearly-28-million-north-dakota-pip-rcna202738
Tornado victims blocked from federal recovery aid after Trump denied request,,14956,736,1745450482.0,https://edition.cnn.com/2025/04/23/weather/trump-denied-disaster-aid-arkansas-tornadoes/index.html
World Leaders From China to EU Hold Climate Meeting Without US,,5517,186,1745449643.0,https://financialpost.com/pmn/business-pmn/world-leaders-from-china-to-eu-hold-climate-meeting-without-us
Hegseth orders makeup studio installed at Pentagon,,1326,215,1745447544.0,https://www.cbsnews.com/news/hegseth-orders-makeup-studio-installed-pentagon/
"U.S. citizen DHS detained for 10 days has intellectual disabilities, family claims",,4745,120,1745420899.0,https://www.cbsnews.com/news/us-citizen-detained-border-nogales-arizona-dhs-10-days-intellectual-disabilities/
Dozen states sue Trump in bid to block new tariffs,,47857,1063,1745440592.0,https://www.cnbc.com/2025/04/23/states-sue-trump-in-bid-to-block-new-tariffs.html
Book publishers see surging interest in the US Constitution and print new editions,,1648,52,1745438956.0,https://apnews.com/article/constitution-declaration-independence-federalist-sales-meacham-5566e2c9ea4206f335dd912e9807bcf7
"After a month of searching, man learns from NBC News that DHS sent his brother to El Salvador",,22107,383,1745437637.0,https://www.nbcnews.com/news/rcna202279
Judge orders Bail hearing for detained student Mohsen Madawi next week,,499,6,1745434991.0,https://www.theguardian.com/us-news/2025/apr/23/mohsen-mahdawi-bail-hearing-vermont
Boeing to sell Jeppesen unit to Thoma Bravo for $10.6 billion,,304,12,1745436935.0,https://www.reuters.com/business/aerospace-defense/buyout-firm-thoma-bravo-nears-deal-boeings-jeppesen-unit-bloomberg-news-reports-2025-04-22/
NFL champion Shannon Sharpe sued for sexual assault,,2158,366,1745436789.0,https://www.bbc.com/news/articles/c99pj3xj38do
‘They just did what they wanted’: Crown outlines sex assault allegations against Canada world junior hockey players,,3534,254,1745430575.0,https://www.thestar.com/news/they-just-did-what-they-wanted-crown-outlines-sex-assault-allegations-against-canada-world-junior/article_c31efe15-fabe-488c-94bd-43972d3e3f16.html
"State of emergency declared as New Jersey wildfire explodes to 11,500 acres",,3916,219,1745429406.0,https://abcnews.go.com/US/wildfire-new-jersey-explodes-8500-acres-residents-evacuated/story?id=121075913
California Man Ordered to Leave the U.S. 'Immediately' Despite Providing Birth Certificate: 'I'm Not Trying to Be One of the Government's Mistakes',,64766,2354,1745423839.0,https://www.latintimes.com/california-man-ordered-leave-us-immediately-despite-providing-birth-certificate-im-not-581422
"4-year-old migrant girl, other kids go to court in NYC with no lawyer: 'The cruelty is apparent'",,33187,1130,1745422147.0,https://gothamist.com/news/4-year-old-migrant-girl-other-kids-go-to-court-in-nyc-with-no-lawyer-the-cruelty-is-apparent?utm_medium=social&utm_source=reddit&utm_campaign=shared_reddit
$50 million prize funded by Musk foundation goes to Indian carbon-capture company,,715,151,1745416075.0,https://apnews.com/article/xprize-climate-carbon-removal-musk-31d41e402fd5386bd564d7145e84e9db
City of Uvalde reaches settlement with families of school shooting victims,,4314,221,1745414460.0,https://abcnews.go.com/US/city-uvalde-reaches-settlement-families-robb-elementary-school/story?id=121072304
"Number of births in US increased by 1% in 2024, according to CDC data",,567,156,1745382603.0,https://www.theguardian.com/us-news/2025/apr/23/births-increase
El Paso Walmart shooter received forgiveness and a hug from victim’s sister,,1393,401,1745379226.0,https://elpasomatters.org/2025/04/22/victims-sister-hugs-walmart-gunman-patrick-crusius-el-paso/
Musk signals 'significantly' stepping back from Doge as Tesla profits plunge,,27951,2350,1745377979.0,https://www.bbc.co.uk/news/articles/cy0x50yr46lo
Lori Vallow Daybell jury returns guilty verdict in Arizona trial over Charles Vallow's death,,1055,57,1745366186.0,https://www.cbsnews.com/news/lori-vallow-daybell-verdict-arizona-trial/
Veterans affairs agency orders staff to report each other for ‘anti-Christian bias’,,10554,794,1745364055.0,https://www.theguardian.com/us-news/2025/apr/22/veterans-affairs-anti-christian-bias?CMP=Share_AndroidApp_Other
"FDA says it will phase out petroleum-based food dyes, authorize four natural color additives",,6761,706,1745359355.0,https://www.cnn.com/2025/04/22/health/fda-food-dyes
Tesla sales plunge as carmaker warns ‘political sentiment’ could impact future demand,,19573,1308,1745357537.0,https://www.theguardian.com/technology/2025/apr/22/tesla-sales-musk-white-house-exit
Panini CEO Aldo Hugo Sallustro passes away at 75,,205,23,1745357015.0,https://collectorclub.co.uk/sports-cards/panini-ceo-aldo-hugo-sallustro-obituary/
Sarah Palin loses retrial of defamation case against New York Times,,26613,611,1745354229.0,https://www.theguardian.com/us-news/2025/apr/22/sarah-palin-loses-defamation-nyt-retrial
Iran parades missiles through the streets in a show of force as nuclear talks ramp up,,388,28,1745352807.0,https://www.nbcnews.com/news/world/iran-nuclear-talks-army-parade-trump-putin-witkoff-rcna201836
IMF cuts growth forecasts for most countries in wake of century-high US tariffs,,949,22,1745351836.0,https://www.reuters.com/business/imf-cuts-growth-forecasts-most-countries-wake-century-high-us-tariffs-2025-04-22/
Chan Zuckerberg Initiative announces it will close East Palo Alto school,,3209,296,1745349075.0,https://www.rwcpulse.com/education/2025/04/21/the-primary-school-to-shut-down-at-end-of-school-year/
"Trump must give some Venezuelan migrants 21 days' notice before deportations, judge rules",,7017,154,1745347237.0,https://www.reuters.com/legal/trump-must-give-some-venezuelan-migrants-21-days-notice-before-deportations-2025-04-22/
"Gunmen open fire on tourists in Himalayan region, killing at least 26 people, police say",,2370,168,1745347151.0,https://www.cnn.com/2025/04/22/asia/gunmen-open-fire-jammu-kashmir-intl/index.html
"Bill Owens, Executive Producer Of ’60 Minutes,’ Resigns, Saying He Lost His Ability To Make “Independent Decisions” About The Show",,7249,161,1745344207.0,https://deadline.com/2025/04/bill-owens-60-minutes-cbs-trump-1236373948/
"Texas measles outbreak surpasses 600 cases with most among children, teens",,5643,246,1745340865.0,https://abcnews.go.com/Health/texas-measles-outbreak-surpasses-600-cases-children-teens/story?id=121042863
US FDA suspends milk quality tests amid workforce cuts,,18779,1280,1745336787.0,https://www.reuters.com/business/healthcare-pharmaceuticals/us-fda-suspends-milk-quality-tests-amid-workforce-cuts-2025-04-21/
"Films made with AI can win Oscars, Academy says",,1225,374,1745333209.0,https://www.bbc.co.uk/news/articles/cqx4y1lrz2vo
"Info Pete Hegseth shared with wife, brother came from top general's secure messages",,40314,890,1745330469.0,https://www.nbcnews.com/politics/national-security/info-hegseths-yemen-signal-texts-came-generals-secure-messages-rcna198838
"Mexican Cartels Are Using Casinos, to Launder Fentanyl Proceedings In the U.S.",,7430,518,1745327618.0,https://www.latintimes.com/mexican-cartels-are-using-casinos-o-launder-fentanyl-proceedings-us-581335
"US sets tariffs of up to 3,521% on South East Asia solar panels",,4336,535,1745315313.0,https://www.bbc.com/news/articles/c5ygdv47vlzo
Walgreens to pay up to $350 million in US opioid settlement,,2393,149,1745310040.0,https://edition.cnn.com/2025/04/22/business/walgreens-opioid-settlement-hnk/index.html
Trial to boldly grow food in space labs blasts off,,336,26,1745303685.0,https://www.bbc.co.uk/news/articles/cp34wzql2xvo
"US FTC sues Uber, alleging deceptive subscription practices",,1376,65,1745291327.0,https://www.bbc.com/news/articles/c1drkq0dy07o
RFK Jr.'s autism study to amass medical records of many Americans,,22054,1970,1745284847.0,https://www.cbsnews.com/news/rfk-jr-autism-study-medical-records/
"Person found on ‘elevated surface’ inside Trump Tower in New York is arrested, police say",,3261,174,1745281904.0,https://www.ctvnews.ca/world/article/person-found-on-elevated-surface-inside-trump-tower-in-new-york-is-arrested-police-say/
"China retreats from US private equity investments, FT reports",,5374,246,1745277079.0,https://www.reuters.com/world/china/china-retreats-us-private-equity-investments-ft-reports-2025-04-21/
"Student loans in default to be referred to debt collection, Education Department says",,19215,1866,1745270643.0,https://apnews.com/article/student-loan-debt-default-collection-fa6498bf519e0d50f2cd80166faef32a
Nadine Menendez found guilty in bribery trial,,1281,28,1745267172.0,https://www.nbcnewyork.com/news/local/crime-and-courts/verdict-nadine-menendez-bribery-trial-jury/6232296/
Passengers on Delta flight evacuate on slides after engine fire at Orlando airport,,697,28,1745259427.0,https://www.nbcnews.com/news/us-news/passengers-delta-flight-evacuate-slides-engine-fire-orlando-airport-rcna202183
Trans pilot falsely blamed in Potomac plane crash sues conservative influencer,,52593,744,1745260529.0,https://www.nbcnews.com/nbc-out/out-news/trans-pilot-falsely-blamed-potomac-plane-crash-sues-conservative-influ-rcna200474
"Pakistan expels 80,000 Afghans in two weeks amid crackdown on undocumented migrants",,1094,68,1745259164.0,https://www.abc.net.au/news/2025-04-19/pakistan-expels-afghans-amid-crackdown-on-undocumented-migrants/105193418
"Dow tumbles more than 1,000 points and dollar hits three-year low",,29405,1690,1745257341.0,https://www.cnn.com/2025/04/21/investing/us-stock-market/index.html
Gunman who killed 23 in a racist attack at a Walmart in El Paso pleads guilty to capital murder,,10552,640,1745253758.0,https://apnews.com/article/el-paso-walmart-massacre-plea-deal-433bf2a50443a184c4f4e1ed003820dc
Homeland Security Sec Kristi Noem has purse stolen in restaurant,,5880,574,1745247292.0,https://www.cnn.com/2025/04/21/politics/homeland-security-kristi-noem-purse-stolen/index.html
Red Lake Nation citizen cited for ‘fake’ license plates in Georgia,,2996,295,1745250664.0,https://www.mprnews.org/story/2025/04/21/red-lake-nation-citizen-cited-for-fake-license-plates-in-georgia
"3 dead, 2 missing as severe weather slams Oklahoma",,930,50,1745241531.0,https://abcnews.go.com/US/easter-weather-severe-flooding/story?id=120986219
"Pope Francis has died, Vatican says in video statement",,55038,1254,1745222516.0,https://www.reuters.com/world/pope-francis-has-died-vatican-says-video-statement-2025-04-21/
El Salvador offers Venezuela prisoner swap involving US deportees,,3157,179,1745206054.0,https://www.bbc.com/news/articles/cn5xl5ppzr2o
China sends back new Boeing jet made too expensive by tariffs,,10943,690,1745202264.0,https://www.theguardian.com/us-news/2025/apr/21/china-returns-boeing-737-jet-us-too-expensive-tariffs
"Defense chief Hegseth shared war plans in second Signal chat, NYT reports",,40320,1101,1745191011.0,https://www.reuters.com/world/us/defense-chief-hegseth-shared-war-plans-second-signal-chat-nyt-reports-2025-04-20
"‘Professional failures’ led to killing of Palestinian medics in Gaza, says Israeli military",,4869,191,1745176799.0,https://www.cnn.com/2025/04/20/middleeast/israeli-military-professional-failures-gaza-medics-intl
Germany seeks to deport an American and 3 EU citizens after pro-Palestinian protest,,3112,395,1745172795.0,https://www.npr.org/2025/04/20/g-s1-60984/germany-deportation-protesters
"Single-engine plane crashes in Illinois, killing all 4 people aboard",,1411,55,1745171037.0,https://www.nbcnews.com/news/us-news/single-engine-plane-crashes-illinois-rcna202021
Chinese executive linked to Bangkok building collapse arrested,,2465,70,1745166298.0,https://www.ctvnews.ca/world/article/chinese-executive-linked-to-bangkok-building-collapse-arrested/
No sweat: Humanoid robots run a Chinese half-marathon alongside flesh-and-blood competitors,,798,172,1745113477.0,https://apnews.com/article/china-robot-half-marathon-153c6823bd628625106ed26267874d21
Officers who attended Jan. 6 rally ask Supreme Court to keep identities anonymous,,29749,625,1745106552.0,https://abcnews.go.com/US/wireStory/seattle-officers-attended-jan-6-rally-us-supreme-120979630
Indonesian student detained by Ice after US secretly revokes his visa,,23479,836,1745106319.0,https://www.theguardian.com/us-news/2025/apr/19/aditya-wahyu-harsono-immigration-indonesia
Austin Metcalf's father has angry exchange with 'Protect White Americans' protest organizer,,5715,474,1745103676.0,https://www.keranews.org/news/2025-04-19/low-turnout-for-protect-white-americans-protest-over-austin-metcalf-stabbing-death-frisco-track-meet-karmelo-anthony-jeff-metcalf-an-angry-exchange
Elections Canada announces record turnout on first day of advance voting | CBC News,,2179,87,1745101606.0,https://www.cbc.ca/news/politics/elections-canada-record-turnout-first-day-advance-voting-1.7514390?__vfz=medium%3Dsharebar
Zelenskyy says Russia still firing on Ukraine despite ‘Easter truce’,,10008,139,1745101121.0,https://www.theguardian.com/world/2025/apr/19/putin-announces-surprise-easter-truce-and-claims-russia-will-not-attack-ukraine-until-monday
Volvo to cut up to 800 US jobs as Trump's tariffs bite,,4617,136,1745092814.0,https://www.reuters.com/business/autos-transportation/volvo-cut-up-800-us-jobs-trumps-tariffs-bite-2025-04-18/
"Bronx mom, son found dead with 4-year-old girl miraculously alive after days of screaming and foul odors.",,10304,398,1745094440.0,https://www.nbcnewyork.com/bronx/bronx-mother-brother-found-dead/6231232/
US chocolate prices surge amid soaring cocoa costs and tariffs | US economy,,2140,157,1745086033.0,https://www.theguardian.com/business/2025/apr/19/chocolate-trump-tariffs
"Russian ruble strengthens vs U.S. dollar, now up 40% since start of 2025",,4614,247,1745072805.0,https://www.reuters.com/markets/currencies/russian-rouble-strengthens-past-81-vs-us-dollar-up-40-since-start-2025-2025-04-18/
Putin declares brief ‘Easter truce’ in war with Ukraine,,1504,168,1745072127.0,https://www.cnn.com/2025/04/19/europe/russia-ukraine-war-easter-truce-intl?cid=ios_app
American born doctor receives email from immigration officials telling her to leave the country immediately,,35758,1597,1745067506.0,https://www.nbcnews.com/news/rcna201698
Video shows doctor with measles treating kids. RFK Jr later praised him as an ‘extraordinary’ healer,,14786,518,1745062613.0,https://apnews.com/article/texas-measles-outbreak-rfk-jr-ben-edwards-2dd7c79d47c64ad2e6d4a4ac3c87ec1f
Families displaced after fatal house explosion,,315,12,1745050509.0,https://www.bbc.com/news/articles/cx27n8g70deo
US Supreme Court orders temporary halt to deportations of Venezuelan migrants,,20961,610,1745042284.0,https://www.reuters.com/world/us/venezuelan-migrants-told-imminent-deportation-under-us-wartime-law-2025-04-18/
Russia sentences 19-year-old woman to nearly three years in a penal colony after poetic anti-war protest | CNN,,3803,134,1745026093.0,https://www.cnn.com/2025/04/18/europe/darya-kozyreva-russia-penal-colony-war-protest-intl-latam/index.html
White House changes COVID.gov web page to page supporting lab leak theory,,8057,681,1745021147.0,https://abcnews.go.com/Health/white-house-covid-web-page-page-supporting-lab/story?id=120956514
Undocumented Immigrant Faces Decades In Prison After Breaking ICE Officer's Nose During Arrest,,21045,1539,1745015692.0,https://www.latintimes.com/undocumented-immigrant-faces-decades-prison-after-breaking-ice-officers-nose-during-arrest-581132
"Man arrested by ICE in Massachusetts can't be moved without notice, judge rules",,10756,254,1745008237.0,https://www.cbsnews.com/boston/news/new-bedford-ice-arrest-window-smashed/
Rapper Boston Richey accused of choking pregnant ex outside Houston club,,100,2,1745008187.0,https://www.click2houston.com/news/local/2025/04/18/rapper-boston-richey-accused-of-choking-pregnant-ex-outside-houston-club/
Judge blocks administration from deporting noncitizens to 3rd countries without due process,,67139,1688,1745003962.0,https://abcnews.go.com/US/judge-blocks-administration-deporting-noncitizens-3rd-countries-due/story?id=120951918
Sex toys cause fire engulfing multiple Staten Island homes: Court docs,,1686,198,1744997394.0,https://www.nbcnewyork.com/local/sex-toys-cause-fire-engulfing-multiple-staten-island-homes-court-docs/6230573/
Measles update: State officials report 36 more cases in West Texas,,3415,129,1744994311.0,https://www.tpr.org/bioscience-medicine/2025-04-18/measles-update-state-officials-report-36-more-cases-in-west-texas
"Key regulators approve merger of Capital One and Discover, paving the way for a new biggest credit card company",,2258,166,1744993790.0,https://edition.cnn.com/2025/04/18/business/capital-one-discover-merger-conditional-approval/index.html
San Diego City Council bans landlords from 'price fixing' with algorithms,,3533,161,1744984316.0,https://www.kpbs.org/news/living/2025/04/15/san-diego-city-council-bans-landlords-from-price-fixing-with-algorithms
Austin Metcalf's father escorted out of Karmelo Anthony's family news conference after unexpected appearance,,5165,1223,1744981663.0,https://www.cbsnews.com/texas/news/austin-metcalfs-father-escorted-out-karmelo-anthonys-family-news-conference/
